[
  {
    "asset_id": "dk1-solar-01",
    "portfolio_id": "demo-solar-dk",
    "name": "Vestmark Solar (demo)",
    "technology": "solar_pv",
    "price_zone": "DK1",
    "capacity_mw": "48.000",
    "data_class": "synthetic"
  },
  {
    "asset_id": "dk1-solar-02",
    "portfolio_id": "demo-solar-dk",
    "name": "Lindholm Solar (demo)",
    "technology": "solar_pv",
    "price_zone": "DK1",
    "capacity_mw": "30.000",
    "data_class": "synthetic"
  },
  {
    "asset_id": "dk1-solar-03",
    "portfolio_id": "demo-solar-dk",
    "name": "Engbakke Solar (demo)",
    "technology": "solar_pv",
    "price_zone": "DK1",
    "capacity_mw": "12.000",
    "data_class": "synthetic"
  }
]
